,cause_0,effect_0,cause_1,effect_1,label
0,The sun was rising.,My body cast a shadow over the grass.,The grass was cut.,My body cast a shadow over the grass.,0
1,The grass was cut.,The garden looked well-groomed.,The sun was rising.,The garden looked well-groomed.,0
2,The woman knew her friend was going through a hard time.,The woman tolerated her friend's difficult behavior.,The woman felt that her friend took advantage of her kindness.,The woman tolerated her friend's difficult behavior.,0
3,The woman felt that her friend took advantage of her kindness.,The woman did not tolerate her friend's difficult behavior anymore.,The woman knew her friend was going through a hard time.,The woman did not tolerate her friend's difficult behavior anymore.,0
4,The cafe reopened in a new location.,The women met for coffee.,They wanted to catch up with each other.,The women met for coffee.,1
5,The cafe reopened in a new location.,The women were surprised.,They wanted to catch up with each other.,The women were surprised.,0
6,It was a birthday party.,The guests of the party hid behind the couch.,It was a surprise party.,The guests of the party hid behind the couch.,1
7,It was a birthday party.,The guests of the party brought candles.,It was a surprise party.,The guests of the party brought candles.,0
8,No one voted for him.,The politician lost the election.,He ran negative campaign ads.,The politician lost the election.,0
9,No one voted for him.,The politician won the election.,He ran negative campaign ads.,The politician won the election.,1
10,I patched the shirt.,The stain came out of the shirt.,I bleached the shirt.,The stain came out of the shirt.,1
11,I patched the shirt.,The shirt did not have a hole anymore.,I bleached the shirt.,The shirt did not have a hole anymore.,0
12,He greeted the cashier.,The man got a discount on his groceries.,He used a coupon.,The man got a discount on his groceries.,1
13,He used a coupon.,The man looked friendly.,He greeted the cashier.,The man looked friendly.,1
14,The physician misdiagnosed the patient.,The patient disclosed confidential information to the physician.,The physician misdiagnosed the patient.,The patient filed a malpractice lawsuit against the physician.,1
15,The patient was a close friend of the physician.,The patient disclosed confidential information to the physician.,The patient was a close friend of the physician.,The patient filed a malpractice lawsuit against the physician.,0
16,The sales associate acted rude to the customer.,The customer filed a complaint with the store manager.,The sales associate undercharged the customer.,The customer filed a complaint with the store manager.,0
17,The sales associate undercharged the customer.,The sales associate sent another invoice to the customer. ,The sales associate acted rude to the customer.,The sales associate sent another invoice to the customer. ,0
18,The faucet was leaky.,The woman repaired her faucet.,The faucet was turned off.,The woman repaired her faucet.,0
19,The faucet was leaky.,The woman could not wash her hands.,The faucet was turned off.,The woman could not wash her hands.,1
20,The elderly woman suffered a stroke.,The woman's daughter came over to clean her house.,The elderly woman suffered a stroke.,The woman's daughter moved in to take care of her.,1
21,The elderly woman made a phone call.,The woman's daughter came over to clean her house.,The elderly woman made a phone call.,The woman's daughter moved in to take care of her.,0
22,The pond froze over for the winter.,People brought boats to the pond.,The pond froze over for the winter.,People skated on the pond.,1
23,The frozen pond thawed in the spring.,People brought boats to the pond.,The frozen pond thawed in the spring.,People skated on the pond.,0
24,The offender violated parole.,She was sent back to jail.,The offender violated parole.,She stole money from a church.,0
25,The offender was poor.,She was sent back to jail.,The offender was poor.,She stole money from a church.,1
26,Her friend stuck an ice cube down her back.,The girl gasped.,Her friend gave her a pat on the back.,The girl gasped.,0
27,Her friend stuck an ice cube down her back.,The girl smiled.,Her friend gave her a pat on the back.,The girl smiled.,1
28,I put it in the dryer.,The shirt shrunk.,I poured bleach on it.,The shirt shrunk.,0
29,I poured bleach on it.,The shirt became clean.,I put it in the dryer.,The shirt became clean.,0
30,It got dark outside.,Snowflakes began to fall from the sky.,It got dark outside.,The moon became visible in the sky.,1
31,It got cold outside.,Snowflakes began to fall from the sky.,It got cold outside.,The moon became visible in the sky.,0
32,The caller said goodbye to me.,I hung up the phone.,The caller identified himself to me.,I hung up the phone.,0
33,The caller identified himself to me.,I recognized the caller.,The caller said goodbye to me.,I recognized the caller.,0
34,The woman's ring slipped off in the shower.,The woman polished the ring.,The woman's ring slipped off in the shower.,The ring went down the drain.,1
35,The woman's ring got dirty.,The ring went down the drain.,The woman's ring got dirty.,The woman polished the ring.,1
36,She won a spelling bee.,The girl received a trophy.,She made a new friend.,The girl received a trophy.,0
37,She made a new friend.,The girl was not lonely anymore.,She won a spelling bee.,The girl was not lonely anymore.,0
38,The woman's date wanted to look like a gentleman.,He opened the door for her.,The woman's date wanted to look like a gentleman.,He asked her if she liked sushi.,0
39,The woman's date wanted to have Japanese cuisine.,He asked her if she liked sushi.,The woman's date wanted to have Japanese cuisine.,He opened the door for her.,0
40,She worried she would catch the flu.,The host cancelled the party.,She was certain she had the flu.,The host cancelled the party.,1
41,She was certain she had the flu.,The woman got vaccinated.,She worried she would catch the flu.,The woman got vaccinated.,1
42,She was attracted to him.,The woman gave the man her phone number.,She was repulsed by him.,The woman gave the man her phone number.,0
43,She was attracted to him.,The woman ignored the man.,She was repulsed by him.,The woman ignored the man.,1
44,She opened her parachute.,The skydiver glided safely to the ground.,She jumped out of the plane.,The skydiver glided safely to the ground.,0
45,She opened her parachute.,The skydiver started to fall down.,She jumped out of the plane.,The skydiver started to fall down.,1
46,The toddler became cranky.,Her mother fixed her hair into pigtails.,The toddler became cranky.,Her mother put her down for a nap.,1
47,The toddler joined a baby pageant.,Her mother fixed her hair into pigtails.,The toddler joined a baby pageant.,Her mother put her down for a nap.,0
48,The grape juice fermented.,The juice evaporated.,The grape juice fermented.,The juice turned to wine.,1
49,The grape juice was boiled.,The juice evaporated.,The grape juice was boiled.,The juice turned to wine.,0
50,The friends were splitting hairs.,The friends' debate dragged on interminably.,The friends saw eye to eye.,The friends' debate dragged on interminably.,0
51,The friends saw eye to eye.,The friends did not have a debate.,The friends were splitting hairs.,The friends did not have a debate.,0
52,She was nervous.,The woman hummed to herself.,She was in a good mood.,The woman hummed to herself.,1
53,She was in a good mood.,The woman trembled.,She was nervous.,The woman trembled.,1
54,The police aimed their weapons at the fugitive.,The fugitive fell to the ground.,The police aimed their weapons at the fugitive.,The fugitive dropped his gun.,1
55,The police shot the fugitive.,The fugitive fell to the ground.,The police shot the fugitive.,The fugitive dropped his gun.,0
56,The patient was dehydrated.,The nurse gave him an IV.,The patient was dehydrated.,The nurse tested his reflexes.,0
57,The patient said his leg felt numb.,The nurse tested his reflexes.,The patient said his leg felt numb.,The nurse gave him an IV.,0
58,The girl found the missing puzzle piece.,She took apart the puzzle.,The girl found the missing puzzle piece.,She completed the puzzle.,1
59,The girl was angry.,She took apart the puzzle.,The girl was angry.,She completed the puzzle.,0
60,He wanted to iron his pants before work.,The man urgently leaped out of bed.,He wanted to shut off the alarm clock.,The man urgently leaped out of bed.,1
61,He wanted to shut off the alarm clock.,The man got up earlier.,He wanted to iron his pants before work.,The man got up earlier.,1
62,The papers were disorganized.,I made photocopies of them.,The papers were disorganized.,I put them into alphabetical order.,1
63,The papers were important.,I put them into alphabetical order.,The papers were important.,I made photocopies of them.,1
64,The woman won the lottery.,She bought a yacht.,The woman won the lottery.,She joined a church.,0
65,The woman felt guilty.,She joined a church.,The woman felt guilty.,She bought a yacht.,0
66,The seamstress pushed the threaded needle into the fabric.,The thread went through the fabric.,The seamstress pushed the threaded needle into the fabric.,The thread wrapped around the needle.,0
67,The seamstress guided the thread through the eye of the needle.,The thread went through the fabric.,The seamstress guided the thread through the eye of the needle.,The thread wrapped around the needle.,1
68,She decided to run for office.,The woman hired a lawyer.,She decided to sue her employer.,The woman hired a lawyer.,1
69,She decided to run for office.,The woman hired a public relations consultant.,She decided to sue her employer.,The woman hired a public relations consultant.,0
70,My favorite song came on the radio.,I covered my ears.,My favorite song came on the radio.,I sang along to it.,1
71,An awful song came on the radio.,I covered my ears.,An awful song came on the radio.,I sang along to it.,0
72,The applicant had experience for the job.,The executive decided not to hire the applicant.,The applicant failed a background check.,The executive decided not to hire the applicant.,1
73,The applicant failed a background check.,The executive decided to hire the applicant.,The applicant had experience for the job.,The executive decided to hire the applicant.,1
74,The man's eye became infected.,He went blind.,The man's eye became infected.,He put on glasses.,0
75,The man had bad eyesight.,He put on glasses.,The man had bad eyesight.,He went blind.,0
76,She saw a black cat.,The girl made a wish.,She saw a shooting star.,The girl made a wish.,1
77,She saw a black cat.,The girl had bad luck.,She saw a shooting star.,The girl had bad luck.,0
78,The woman shivered as she got out the pool.,She wrapped herself in a towel.,The woman shivered as she got out the pool.,She poured herself some lemonade.,0
79,The woman was thirsty after she jogged.,She poured herself some lemonade.,The woman was thirsty after she jogged.,She wrapped herself in a towel.,0
80,The nurse prepared the needle for the patient's injection.,The patient tensed up.,The nurse prepared the needle for the patient's injection.,The patient bled.,0
81,The nurse made a mistake during the patient's injection.,The patient bled.,The nurse made a mistake during the patient's injection.,The patient tensed up.,0
82,It was fresh.,The man threw out the bread.,It was stale.,The man threw out the bread.,1
83,It was stale.,The man liked the bread.,It was fresh.,The man liked the bread.,1
84,They had a pillow fight.,The children knocked over a lamp.,They jumped on the bed.,The children knocked over a lamp.,0
85,They jumped on the bed.,The children bumped their heads on the ceiling.,They had a pillow fight.,The children bumped their heads on the ceiling.,0
86,I was thirsty.,I drank from the water fountain.,I felt nauseous.,I drank from the water fountain.,0
87,I was thirsty.,I went to the toilet.,I felt nauseous.,I went to the toilet.,1
88,The bodybuilder lifted weights.,The gym closed.,The bodybuilder lifted weights.,Her muscles became fatigued.,1
89,Bodybuilding fell out of fashion.,Her muscles became fatigued.,Bodybuilding fell out of fashion.,The gym closed.,1
90,The cook stirred the ingredients in the bowl.,The ingredients blended together.,The cook stirred the ingredients in the bowl.,The ingredients melted.,0
91,The cook boiled the ingredients in the bowl.,The ingredients melted.,The cook boiled the ingredients in the bowl.,The ingredients blended together.,0
92,The man signed the document.,The transaction was voided.,The man signed the document.,The transaction became official.,1
93,The man returned the document.,The transaction was voided.,The man returned the document.,The transaction became official.,0
94,The police officer dropped the gun.,The gun went off.,The police officer dropped the gun.,The gun recoiled.,0
95,The police officer shot the gun.,The gun went off.,The police officer shot the gun.,The gun recoiled.,1
96,The woman felt compelled to help someone in need.,She donated blood.,The woman felt compelled to help someone in need.,She wrote a poem.,0
97,The woman felt compelled to express herself.,She donated blood.,The woman felt compelled to express herself.,She wrote a poem.,1
98,The woman felt lonely.,She renovated her kitchen.,The woman felt lonely.,She adopted a cat.,1
99,The woman felt creative.,She renovated her kitchen.,The woman felt creative.,She adopted a cat.,0
100,I rubbed sandpaper on the wood.,The wood became smooth.,I rubbed sandpaper on the wood.,The wood became sticky.,0
101,I spilled glue on the wood.,The wood became sticky.,I spilled glue on the wood.,The wood became smooth.,0
102,The crowd gave the band a standing ovation.,The band reappeared on the stage.,The crowd gave the band a standing ovation.,The band signed autographs.,0
103,The crowd waited for the rock band at the airport.,The band signed autographs.,The crowd waited for the rock band at the airport.,The band reappeared on the stage.,0
104,The man threw his empty can onto the street.,He was fined for littering.,The man threw his empty can onto the street.,He was jumped from behind.,0
105,The man walked alone on the street.,He was fined for littering.,The man walked alone on the street.,He was jumped from behind.,1
106,I was full from breakfast.,My stomach growled.,I forgot to eat breakfast.,My stomach growled.,1
107,I was full from breakfast.,My stomach was heavy.,I forgot to eat breakfast.,My stomach was heavy.,0
108,The boaters set off a flare.,Their boat drifted to shore.,The boaters set off a flare.,Their boat was rescued.,1
109,The boaters caught a nice current.,Their boat drifted to shore.,The boaters caught a nice current.,Their boat was rescued.,0
110,He entered the house.,The man removed his coat.,He loosened his tie.,The man removed his coat.,0
111,He loosened his tie.,The man could breathe better.,He entered the house.,The man could breathe better.,0
112,The dog injured his paw.,The family took their dog to the veterinarian.,The dog chewed on a bone.,The family took their dog to the veterinarian.,0
113,The dog injured his paw.,The dog broke his teeth.,The dog chewed on a bone.,The dog broke his teeth.,1
114,The woman dangled the biscuit above the dog.,The dog jumped up.,The woman dangled the biscuit above the dog.,The dog scratched its fur.,0
115,The dog had lice.,The dog jumped up.,The dog had lice.,The dog scratched its fur.,1
116,My friend got the rules wrong.,I learned how to play the board game.,My friend explained the rules to me.,I learned how to play the board game.,1
117,My friend explained the rules to me.,The board game ended in a disaster.,My friend got the rules wrong.,The board game ended in a disaster.,1
118,He wanted to relax.,The man went away for the weekend.,He felt content.,The man went away for the weekend.,0
119,He felt content.,The man did not need to buy more things.,He wanted to relax.,The man did not need to buy more things.,0
120,The shop was undergoing renovation.,The shop was closed.,The owner was helping customers.,The shop was closed.,0
121,The shop was undergoing renovation.,The shop was very popular.,The owner was helping customers.,The shop was very popular.,1
122,The station was playing rock music.,The boy tuned the radio.,The station was coming in with static.,The boy tuned the radio.,1
123,The station was playing rock music.,The boy listened to the radio.,The station was coming in with static.,The boy listened to the radio.,0
124,The terrorist set off the bomb.,The bomb was deactivated.,The terrorist set off the bomb.,The bomb exploded.,1
125,The police found the bomb.,The bomb was deactivated.,The police found the bomb.,The bomb exploded.,0
126,The authorities vowed to protect the identity of the crime victim.,The victim struggled to recall details about the crime.,The authorities vowed to protect the identity of the crime victim.,They withheld the victim's name from the public.,1
127,The authorities brought on the case many years later.,They withheld the victim's name from the public.,The authorities brought on the case many years later.,The victim struggled to recall details about the crime.,1
128,He bought them on sale.,The man's clothes fit loosely.,He lost weight.,The man's clothes fit loosely.,1
129,He lost weight.,The man's clothes were cheap.,He bought them on sale.,The man's clothes were cheap.,1
130,The clock stopped ticking.,I took extra time to get ready.,The clock stopped ticking.,The clock showed the wrong time.,1
131,The time was earlier than I thought.,The clock showed the wrong time.,The time was earlier than I thought.,I took extra time to get ready.,1
132,He got out of the car.,The man closed the umbrella.,He approached the building.,The man closed the umbrella.,1
133,He approached the building.,The man opened the umbrella.,He got out of the car.,The man opened the umbrella.,1
134,The man dropped food on the floor.,His dog ran over to eat the food.,The man dropped food on the floor.,His dog jumped up on him.,0
135,The man had a cookie in his hand.,His dog ran over to eat the food.,The man had a cookie in his hand.,His dog jumped up on him.,1
136,The girl was angry with her friend.,The girl told a secret to her friend.,The girl was angry with her friend.,The girl spread a rumor about her friend.,1
137,The girl trusted her friend.,The girl told a secret to her friend.,The girl trusted her friend.,The girl spread a rumor about her friend.,0
138,The fugitive hid from the police.,The fugitive remained at large.,The fugitive hid from the police.,The police dropped the case.,0
139,The fugitive was shot by the police.,The police dropped the case.,The fugitive was shot by the police.,The fugitive remained at large.,0
140,I tipped the bottle.,The liquid in the bottle poured out.,I tipped the bottle.,The liquid in the bottle froze.,0
141,I put the bottle into a freezer.,The liquid in the bottle froze.,I put the bottle into a freezer.,The liquid in the bottle poured out.,0
142,She came from a wealthy family.,The woman spoke with a foreign accent.,She migrated from another country.,The woman spoke with a foreign accent.,1
143,She came from a wealthy family.,The woman was rich.,She migrated from another country.,The woman was rich.,0
144,He blew out the candle.,The boy's mouth stung.,He ate a pepper.,The boy's mouth stung.,1
145,He blew out the candle.,Smoke got in the boy's eyes.,He ate a pepper.,Smoke got in the boy's eyes.,0
146,I finished a page of the book.,I turned to the next page.,I finished a page of the book.,I ripped out the next page.,0
147,I got angry while reading the book.,I ripped out the next page.,I got angry while reading the book.,I turned to the next page.,0
148,The restaurant was crowded.,The service at the restaurant was slow.,There were many empty tables.,The service at the restaurant was slow.,0
149,There were many empty tables.,The service at the restaurant was quick.,The restaurant was crowded.,The service at the restaurant was quick.,0
150,I saw a woman getting robbed on the street.,I called 911.,I saw a woman getting robbed on the street.,I hailed a cab.,0
151,I was late for the meeting.,I hailed a cab.,I was late for the meeting.,I called 911.,0
152,I ate birthday cake.,My stomach hurt.,I jogged on the treadmill.,My stomach hurt.,0
153,I jogged on the treadmill.,My feet hurt.,I ate birthday cake.,My feet hurt.,0
154,I finished eating.,I put my plate in the sink.,I skipped dinner.,I put my plate in the sink.,0
155,I finished eating.,I didn't have to do the dishes.,I skipped dinner.,I didn't have to do the dishes.,1
156,It provoked him to think.,The man closed the book.,He finished reading it.,The man closed the book.,1
157,He finished reading it.,The man liked the book.,It provoked him to think.,The man liked the book.,1
158,His grandfather was deaf.,The boy read the novel aloud to his grandfather.,His grandfather was blind.,The boy read the novel aloud to his grandfather.,1
159,His grandfather was deaf.,The boy communicated with his grandfather by writing.,His grandfather was blind.,The boy communicated with his grandfather by writing.,0
160,My foot went numb.,I shook my foot.,My foot went numb.,I put my shoes on.,0
161,The sand at the beach was too hot.,I put my shoes on.,The sand at the beach was too hot.,I shook my foot.,0
162,The photographer got the child to smile.,The photographer quickly snapped the child's photo.,The photographer got the child to smile.,The photographer quickly changed the child's pose.,0
163,The photographer could not see the child's face.,The photographer quickly changed the child's pose.,The photographer could not see the child's face.,The photographer quickly snapped the child's photo.,0
164,The tile was cracked.,I slipped on the floor.,The tile was wet.,I slipped on the floor.,1
165,The tile was cracked.,I cut my foot on the floor.,The tile was wet.,I cut my foot on the floor.,0
166,The man slid the razor across his chin.,His stubble grew.,The man slid the razor across his chin.,His stubble disappeared.,1
167,The man did not shave.,His stubble disappeared.,The man did not shave.,His stubble grew.,1
168,Her husband got laid off.,The woman took her family on vacation.,She received a salary bonus.,The woman took her family on vacation.,1
169,She received a salary bonus.,The woman looked for a job.,Her husband got laid off.,The woman looked for a job.,1
170,She took sleeping pills.,The woman awakened.,Her husband was snoring.,The woman awakened.,1
171,Her husband was snoring.,The woman did not wake up.,She took sleeping pills.,The woman did not wake up.,1
172,The woman sensed a pleasant smell.,She remembered to take her medication.,The woman sensed a pleasant smell.,She was reminded of her childhood.,1
173,The woman felt dizzy.,She was reminded of her childhood.,The woman felt dizzy.,She remembered to take her medication.,1
174,It was 3 AM.,The bar closed.,It was crowded.,The bar closed.,0
175,It was crowded.,There was nowhere to sit in the bar.,It was 3 AM.,There was nowhere to sit in the bar.,0
176,The teacher took roll.,She identified the students that were absent.,The teacher took roll.,She gave her students a pop quiz.,0
177,The teacher wanted to grade the students.,She gave her students a pop quiz.,The teacher wanted to grade the students.,She identified the students that were absent.,0
178,I pushed the pendulum.,It swung back and forth.,I pushed the pendulum.,It slowed to a stop.,0
179,I blocked the pendulum.,It swung back and forth.,I blocked the pendulum.,It slowed to a stop.,1
180,The child kicked the stack of blocks.,The stack towered over the boy's head.,The child kicked the stack of blocks.,The blocks scattered all over the rug.,1
181,The child punched the stack of blocks.,The stack towered over the boy's head.,The child punched the stack of blocks.,The blocks scattered all over the rug.,0
182,He relied on his parents.,The teenager ran away from home.,His parents abused him.,The teenager ran away from home.,1
183,He relied on his parents.,The teenager always stayed home.,His parents abused him.,The teenager always stayed home.,0
184,I anticipated the interviewer's questions.,I botched the job interview.,The interviewer asked difficult questions.,I botched the job interview.,1
185,I anticipated the interviewer's questions.,I passed the job interview.,The interviewer asked difficult questions.,I passed the job interview.,0
186,Users got refills on their prescriptions.,The pharmaceutical company recalled the drug.,Users reported dangerous side effects.,The pharmaceutical company recalled the drug.,1
187,Users got refills on their prescriptions.,The pharmaceutical company promoted the drug.,Users reported dangerous side effects.,The pharmaceutical company promoted the drug.,0
188,The man looked at his watch.,He realized he was early.,The man looked at his watch.,He realized he forgot something.,0
189,The man looked at his list.,He realized he was early.,The man looked at his list.,He realized he forgot something.,1
190,The floor was permanently stained.,I dabbed the floor with a paper towel.,I spilled juice on the floor.,I dabbed the floor with a paper towel.,1
191,I spilled juice on the floor.,I replaced the floor with brand new tile.,The floor was permanently stained.,I replaced the floor with brand new tile.,1
192,The patron was alone.,The bartender refused to serve the patron.,The patron was drunk.,The bartender refused to serve the patron.,1
193,The patron was drunk.,The bartender accompanied the patron.,The patron was alone.,The bartender accompanied the patron.,1
194,I was confused by the professor's lecture.,I asked the professor questions.,I was confused by the professor's lecture.,I paid attention to the professor.,0
195,I was interested in the professor's lecture.,I paid attention to the professor.,I was interested in the professor's lecture.,I asked the professor questions.,0
