,cause_0,effect_0,cause_1,effect_1,label
196,The book was deemed inappropriate for children.,Schools banned it from its libraries.,The book was deemed inappropriate for children.,Teachers required students to read it.,0
197,The book was deemed appropriate for children.,Teachers required students to read it.,The book was deemed appropriate for children.,Schools banned it from its libraries.,0
198,The man begged for forgiveness.,The woman joked around with him.,The man begged for forgiveness.,The woman took pity on him.,1
199,The man laughed at comedy.,The woman joked around with him.,The man laughed at comedy.,The woman took pity on him.,0
200,I received a package in the mail.,I took the package to the post office.,I received a package in the mail.,The package triggered my curiosity.,1
201,I received someone's package in the mail.,I took the package to the post office.,I received someone's package in the mail.,The package triggered my curiosity.,0
202,The speaker disarmed her debate opponent.,The speaker congratulated her opponent.,The speaker disarmed her debate opponent.,The speaker won the debate.,1
203,The speaker was defeated by her debate opponent.,The speaker won the debate.,The speaker was defeated by her debate opponent.,The speaker congratulated her opponent.,1
204,My son was born.,I moved to a new city.,I found a better-paying job.,I moved to a new city.,1
205,My son was born.,I was moved.,I found a better-paying job.,I was moved.,0
206,The question made me uncomfortable.,I avoided giving a straight answer to the question.,I wanted to be honest.,I avoided giving a straight answer to the question.,0
207,The question made me uncomfortable.,I promised to give a straight answer to the question.,I wanted to be honest.,I promised to give a straight answer to the question.,1
208,He talked back to the teacher.,The student received detention.,The teacher graded his homework.,The student received detention.,0
209,He talked back to the teacher.,The student learned most mistakes.,The teacher graded his homework.,The student learned most mistakes.,1
210,He planned to ask the girl out.,The boy's hands were shaking.,His palms were cold and sweaty.,The boy's hands were shaking.,0
211,He planned to ask the girl out.,The boy's friends were scared.,His palms were cold and sweaty.,The boy's friends were scared.,1
212,The game ended in a tie.,The fans in the stadium cheered.,The player scored.,The fans in the stadium cheered.,1
213,The player scored.,The fans in the stadium were apathetic.,The game ended in a tie.,The fans in the stadium were apathetic.,1
214,The girl went down the hill on her bike.,Her bike swerved.,The girl went down the hill on her bike.,Her bike sped up.,1
215,The girl turned down the hill on her bike.,Her bike sped up.,The girl turned down the hill on her bike.,Her bike swerved.,1
216,A man cut in front of me in the long line.,I confronted him.,A man cut in front of me in the long line.,I smiled at him.,0
217,A man let me in front of the long line.,I confronted him.,A man let me in front of the long line.,I smiled at him.,1
218,The train travelled through a tunnel.,The inside of the train went dark.,The train ran off the tracks.,The inside of the train went dark.,0
219,The train ran off the tracks.,The inside of the train became destroyed.,The train travelled through a tunnel.,The inside of the train became destroyed.,0
220,It detected a predator.,The turtle hid in its shell.,It ate a fish.,The turtle hid in its shell.,0
221,It detected a predator.,The turtle felt tired.,It ate a fish.,The turtle felt tired.,1
222,She outgrew the clothes.,The girl handed down her clothes to her younger sister.,The clothes were tattered.,The girl handed down her clothes to her younger sister.,0
223,The clothes were tattered.,The girl threw her clothes away.,She outgrew the clothes.,The girl threw her clothes away.,0
224,Several witnesses of the crime testified against the suspect.,The suspect was acquitted.,Several witnesses of the crime testified against the suspect.,The suspect was convicted.,1
225,No witnesses of the crime testified against the suspect.,The suspect was convicted.,No witnesses of the crime testified against the suspect.,The suspect was acquitted.,1
226,They made plans to celebrate their anniversary.,The parents left their children with a babysitter.,Their youngest child started attending preschool.,The parents left their children with a babysitter.,0
227,They made plans to celebrate their anniversary.,The parents left their children with a teacher.,Their youngest child started attending preschool.,The parents left their children with a teacher.,1
228,The product was heavily advertised.,The product became outdated.,The product was heavily advertised.,Consumers recognized the product.,1
229,The producted was replaced.,The product became outdated.,The producted was replaced.,Consumers recognized the product.,0
230,The cowgirl threw her lasso towards the horse.,The lasso grabbed onto the horse.,The cowgirl threw her lasso towards the horse.,The horse trotted into the barn.,0
231,The cowgirl missed her lasso towards the horse.,The horse trotted into the barn.,The cowgirl missed her lasso towards the horse.,The lasso grabbed onto the horse.,0
232,The group overlooked the woman's faux pas.,The woman apologized.,The group overlooked the woman's faux pas.,The woman was relieved.,1
233,The group was offended by the woman's faux pas.,The woman apologized.,The group was offended by the woman's faux pas.,The woman was relieved.,0
234,The girl came across an unfamiliar word in her textbook.,She looked the term up in the dictionary.,The girl came across an unfamiliar word in her textbook.,She chucked the textbook across the room.,0
235,The girl came across an offensive word in her textbook.,She chucked the textbook across the room.,The girl came across an offensive word in her textbook.,She looked the term up in the dictionary.,0
236,The man became disabled.,His family cut off contact with him.,The man became disabled.,His family offered him financial support.,1
237,The man became offensive.,His family offered him financial support.,The man became offensive.,His family cut off contact with him.,1
238,The flashlight was dead.,I took it apart.,The flashlight was dead.,I replaced the batteries.,1
239,The flashlight was broken.,I replaced the batteries.,The flashlight was broken.,I took it apart.,1
240,The skunk sprayed the dog.,The dog emitted a foul smell.,The skunk sprayed the dog.,The skunk roamed the woods.,0
241,The skunk became hungry.,The skunk roamed the woods.,The skunk became hungry.,The dog emitted a foul smell.,0
242,I scratched my skin.,My itch went away.,I scratched my skin.,My scar faded.,0
243,I cleaned my skin.,My scar faded.,I cleaned my skin.,My itch went away.,0
244,She sent me a gift.,I wrote a thank-you note to my grandmother.,She became forgetful.,I wrote a thank-you note to my grandmother.,0
245,She sent me a gift.,I wrote a reminder note to my grandmother.,She became forgetful.,I wrote a reminder note to my grandmother.,1
246,I held the door for the woman entering behind me.,The woman thanked me.,I held the door for the woman entering behind me.,The door slammed shut.,0
247,The woman behind me left the door open.,The woman thanked me.,The woman behind me left the door open.,The door slammed shut.,1
248,The mirror in the bathroom fogged up.,The girl applied her makeup.,The mirror in the bathroom fogged up.,The girl turned on the fan.,1
249,The mirror in the bathroom cleared up.,The girl turned on the fan.,The mirror in the bathroom cleared up.,The girl applied her makeup.,1
250,The driver rotated the steering wheel.,The car turned.,The driver rotated the steering wheel.,The car halted.,0
251,The drived pressed on the brakes.,The car halted.,The drived pressed on the brakes.,The car turned.,0
252,The navy bombed the ship.,The ship crashed into the pier.,The navy bombed the ship.,The ship's debris sunk in the sea.,1
253,The captain passed out.,The ship's debris sunk in the sea.,The captain passed out.,The ship crashed into the pier.,1
254,The girl felt dizzy.,She did stretches.,The girl felt dizzy.,She lost her balance.,1
255,The girl wanted to exercise.,She lost her balance.,The girl wanted to exercise.,She did stretches.,1
256,He noticed a stranded vehicle.,The driver pulled over to the side of the road.,He went through an intersection.,The driver pulled over to the side of the road.,0
257,He noticed a stranded vehicle.,The driver crashed over to the side of the road.,He went through an intersection.,The driver crashed over to the side of the road.,1
258,The patient's symptoms cleared up.,The hospital sent the patient home.,The patient's family visited him.,The hospital sent the patient home.,0
259,The patient's family visited him.,The patient felt happy.,The patient's symptoms cleared up.,The patient felt happy.,0
260,She didn't get vaccinated.,The child caught a life-threatening illness.,She was adopted.,The child caught a life-threatening illness.,0
261,She was adopted.,The child did not know her parents.,She didn't get vaccinated.,The child did not know her parents.,0
262,We found empty seats in the theatre.,We sat down.,We found empty seats in the theatre.,The film began.,0
263,The opening credits finished playing.,The film began.,The opening credits finished playing.,We sat down.,0
264,The parents recognized their daughter's creativity.,They encouraged her to become an artist.,The parents recognized their daughter's creativity.,They taught her how to ride a bike.,0
265,The parents recognized their daughter's interest in sports.,They encouraged her to become an artist.,The parents recognized their daughter's interest in sports.,They taught her how to ride a bike.,1
266,The boy turned the lid on the jar.,The jar became warm.,The boy turned the lid on the jar.,The lid came off.,1
267,The boy rubbed the side of the jar.,The lid came off.,The boy rubbed the side of the jar.,The jar became warm.,1
268,She enrolled in college.,The woman received a diploma.,She graduated from college.,The woman received a diploma.,1
269,She enrolled in college.,The woman aimed for a diploma.,She graduated from college.,The woman aimed for a diploma.,0
270,I ran five miles.,I chugged the pitcher of water.,I walked upstairs.,I chugged the pitcher of water.,0
271,I walked upstairs.,I reached the top of the building.,I ran five miles.,I reached the top of the building.,0
272,I came upon a puddle on the sidewalk.,I leapt over the puddle.,I came upon a puddle on the sidewalk.,I played in the puddle.,0
273,The puddle on the sidewalk looked fun.,I leapt over the puddle.,The puddle on the sidewalk looked fun.,I played in the puddle.,1
274,The archeologist dug up the site.,She read about the site's history.,The archeologist dug up the site.,She excavated ancient artifacts.,1
275,The archelogist discovered the site.,She read about the site's history.,The archelogist discovered the site.,She excavated ancient artifacts.,0
276,He entertained the audience.,The audience booed the comedian off the stage.,He told a racist joke.,The audience booed the comedian off the stage.,1
277,He entertained the audience.,The audience applauded the comedian on stage.,He told a racist joke.,The audience applauded the comedian on stage.,0
278,The player got a penalty.,The coach gave his player a high five.,The player scored a point.,The coach gave his player a high five.,1
279,The player got a penalty.,The coach gave his player a headshake.,The player scored a point.,The coach gave his player a headshake.,0
280,My breath smelled of garlic.,I wiped my mouth.,My breath smelled of garlic.,I brushed my teeth.,1
281,My lips were covered in garlic.,I wiped my mouth.,My lips were covered in garlic.,I brushed my teeth.,0
282,The man was lost.,He asked for directions.,The man was lost.,He drew a map.,0
283,The man was local.,He drew a map.,The man was local.,He asked for directions.,0
284,The baby pulled the mother's hair.,The mother grimaced.,The baby pulled the mother's hair.,The baby burped.,0
285,The mother patted the baby's back.,The mother grimaced.,The mother patted the baby's back.,The baby burped.,1
286,I stood on one foot.,My balance wavered.,I stood on one foot.,I kneeled down.,0
287,I was tired of standing.,I kneeled down.,I was tired of standing.,My balance wavered.,0
288,I pushed the gas pedal.,The car accelerated.,I pushed the gas pedal.,The car door opened.,0
289,I pulled on the knob.,The car door opened.,I pulled on the knob.,The car accelerated.,0
290,I jumped the battery.,My car was towed.,I parked illegally.,My car was towed.,1
291,I parked illegally.,My car was rejuvenated.,I jumped the battery.,My car was rejuvenated.,1
292,She destroyed the evidence.,The woman got away with the crime.,Her accomplice was apprehended.,The woman got away with the crime.,0
293,Her accomplice was apprehended.,The woman got charged with the crime.,She destroyed the evidence.,The woman got charged with the crime.,0
294,The motorcyclist twisted the throttle.,The motorcycle shot forward.,The motorcyclist twisted the throttle.,The motorcycle coasted to a halt.,0
295,The motorcyclist let go of the throttle.,The motorcycle coasted to a halt.,The motorcyclist let go of the throttle.,The motorcycle shot forward.,0
296,The teacher caught the student chewing gum.,The student spit out the gum.,The teacher caught the student chewing gum.,The gum stuck to the student's shoe.,0
297,The teacher threw the chewing gum at the student.,The student spit out the gum.,The teacher threw the chewing gum at the student.,The gum stuck to the student's shoe.,1
298,The host served dinner to his guests.,His guests were gracious.,The host served dinner to his guests.,His guests went hungry.,0
299,The host served nothing to his guests.,His guests went hungry.,The host served nothing to his guests.,His guests were gracious.,0
300,A bird built a nest in the tree.,The boy climbed the tree.,A cat got stuck in the tree.,The boy climbed the tree.,1
301,A bird built a nest in the tree.,The boy avoided the tree.,A cat got stuck in the tree.,The boy avoided the tree.,0
302,The man carried the chair to his office.,The chair squeaked.,The man scooted the chair closer to his desk.,The chair squeaked.,1
303,The man carried the chair to his office.,The chair fell.,The man scooted the chair closer to his desk.,The chair fell.,0
304,It was bedtime for the children.,The father shut off the children's television.,The children were watching cartoons.,The father shut off the children's television.,0
305,The children were watching cartoons.,The father laughed at the children's television.,It was bedtime for the children.,The father laughed at the children's television.,0
306,He treaded water.,The man held his breath.,He went underwater.,The man held his breath.,1
307,He treaded water.,The man exhaled his breath.,He went underwater.,The man exhaled his breath.,0
308,I clumsily bumped into the stranger.,I ran away.,I clumsily bumped into the stranger.,I apologized to him.,1
309,I intentionally bumped into the stranger.,I ran away.,I intentionally bumped into the stranger.,I apologized to him.,0
310,It was caught in a hurricane.,The boat capsized.,The captain raised the sail.,The boat capsized.,0
311,It was caught in a hurricane.,The boat moved.,The captain raised the sail.,The boat moved.,1
312,He refused to talk to her.,The mother suspected that her son was lying.,He avoided making eye contact with her.,The mother suspected that her son was lying.,1
313,He refused to talk to her.,The mother suspected that her son was upset.,He avoided making eye contact with her.,The mother suspected that her son was upset.,0
314,Her friends stood her up.,The young woman was denied entrance into the bar.,She forgot her ID.,The young woman was denied entrance into the bar.,1
315,Her friends stood her up.,The young woman entered the bar alone.,She forgot her ID.,The young woman entered the bar alone.,0
316,A comet passed by the moon.,A crater formed on the moon.,A comet collided with the moon.,A crater formed on the moon.,1
317,A comet collided with the moon.,A crater did not form on the moon.,A comet passed by the moon.,A crater did not form on the moon.,1
318,I planted the seeds in the soil.,The seeds sprouted.,I planted the seeds in the soil.,I watered the soil.,0
319,The soil was dry.,I watered the soil.,The soil was dry.,The seeds sprouted.,0
320,He supported the cause behind his donation.,The benefactor requested to stay anonymous.,He wanted to maintain his privacy.,The benefactor requested to stay anonymous.,1
321,He supported the cause behind his donation.,The benefactor looked extremely excited.,He wanted to maintain his privacy.,The benefactor looked extremely excited.,0
322,The doctor x-rayed the patient's arm.,He put the patient's arm in a cast.,The doctor x-rayed the patient's arm.,He discovered that the patient's arm was broken.,1
323,The doctor discovered the patient's arm was broken.,He discovered that the patient's arm was broken.,The doctor discovered the patient's arm was broken.,He put the patient's arm in a cast.,1
324,The woman upgraded her computer hardware.,She deleted old files on the computer.,The woman upgraded her computer hardware.,She installed new software on the computer.,1
325,The woman wanted to sell her computer hardware.,She installed new software on the computer.,The woman wanted to sell her computer hardware.,She deleted old files on the computer.,1
326,The girl performed in a dance recital.,Her parents came to watch the recital.,The girl performed in a dance recital.,Her parents showed her how to dance.,0
327,The girl never learned to dance.,Her parents came to watch the recital.,The girl never learned to dance.,Her parents showed her how to dance.,1
328,The baby was wailing in his crib.,The mother picked up the baby.,The baby was wailing in his crib.,The baby crawled to the mother.,0
329,The baby's name was called.,The mother picked up the baby.,The baby's name was called.,The baby crawled to the mother.,1
330,The woman had a religious awakening.,She began going to church.,The woman had a religious awakening.,She began travelling abroad.,0
331,The woman wanted to change her environment.,She began travelling abroad.,The woman wanted to change her environment.,She began going to church.,0
332,The bureau drawers were cluttered.,I locked the drawers shut.,The bureau drawers were cluttered.,I threw away unnecessary contents.,1
333,The buerau drawers were opened.,I threw away unnecessary contents.,The buerau drawers were opened.,I locked the drawers shut.,1
334,He feigned interest in the class.,The student flaunted his test grade to his classmates.,He received a perfect score.,The student flaunted his test grade to his classmates.,1
335,He received a perfect score.,The student hid his test grade from his classmates.,He feigned interest in the class.,The student hid his test grade from his classmates.,1
336,He went away to camp.,The boy felt homesick.,He bickered with his sister.,The boy felt homesick.,0
337,He bickered with his sister.,The boy felt exhausted.,He went away to camp.,The boy felt exhausted.,0
338,The girl designed it.,The rocket flew up into the sky.,The girl launched it.,The rocket flew up into the sky.,1
339,The girl designed it.,The rocket looked pretty.,The girl launched it.,The rocket looked pretty.,0
340,The boy murmured his reply to his mother.,His mother told him to whisper.,The boy murmured his reply to his mother.,His mother told him to speak up.,1
341,The boy yelled his reply to his mother.,His mother told him to speak up.,The boy yelled his reply to his mother.,His mother told him to whisper.,1
342,Tornadoes were sighted in the area.,My flight got delayed.,I was held up at airport security.,My flight got delayed.,0
343,Tornadoes were sighted in the area.,My flight got rescheduled.,I was held up at airport security.,My flight got rescheduled.,1
344,I lit a candle.,The smoke alarm went off.,I burnt my dinner.,The smoke alarm went off.,1
345,I lit a candle.,The room became bright.,I burnt my dinner.,The room became bright.,0
346,The vase broke.,I stenciled it.,The vase broke.,I glued it back together.,1
347,The vase had a nice shape.,I glued it back together.,The vase had a nice shape.,I stenciled it.,1
348,She pounded on the door.,The woman felt an electric shock.,She grabbed the doorknob.,The woman felt an electric shock.,1
349,She grabbed the doorknob.,The woman felt extremely fatigued.,She pounded on the door.,The woman felt extremely fatigued.,1
350,The woman made him blush.,The man had lipstick on his cheek.,The woman kissed him.,The man had lipstick on his cheek.,1
351,The woman kissed him.,The man had a grin on his face.,The woman made him blush.,The man had a grin on his face.,1
352,The gardener wanted his plants to flourish.,He planted a variety of seeds.,The gardener wanted his plants to flourish.,He put fertilizer in the soil.,1
353,The gardener wanted more plants to flourish.,He put fertilizer in the soil.,The gardener wanted more plants to flourish.,He planted a variety of seeds.,1
354,The water was unsanitary.,A water pipe in the house burst.,The pipe froze.,A water pipe in the house burst.,1
355,The water was unsanitary.,A water pipe in the house was leaking.,The pipe froze.,A water pipe in the house was leaking.,0
356,The waistband on my pants was loose.,I put on a belt.,The waistband on my pants was loose.,I put on a hat.,0
357,The sun shined so bright.,I put on a belt.,The sun shined so bright.,I put on a hat.,1
358,Its products received positive consumer reviews.,The company lost money.,Some of its products were manufactured defectively.,The company lost money.,1
359,Its products received positive consumer reviews.,The company sold more products.,Some of its products were manufactured defectively.,The company sold more products.,0
360,They neglected to pay their rent.,The tenants were evicted from the apartment.,They got along with their landlord.,The tenants were evicted from the apartment.,0
361,They got along with their landlord.,The tenants lease for the apartment was extended.,They neglected to pay their rent.,The tenants lease for the apartment was extended.,0
362,The man woke up with a toothache.,He missed an appointment with the dentist.,The man woke up with a toothache.,He made an appointment with the dentist.,1
363,The man woke up late.,He missed an appointment with the dentist.,The man woke up late.,He made an appointment with the dentist.,0
364,The movie was rated R.,The parents forbade their children from watching the movie. ,The movie was animated.,The parents forbade their children from watching the movie. ,0
365,The movie was rated R.,The parents allowed their children to watch the movie.,The movie was animated.,The parents allowed their children to watch the movie.,1
366,The sender tried to solicit money from her.,The woman deleted the email.,The sender requested a response from her.,The woman deleted the email.,0
367,The sender tried to solicit money from her.,The woman read the email.,The sender requested a response from her.,The woman read the email.,1
368,The police interrogated her.,The police eliminated the woman from the list of suspects.,Her alibi checked out.,The police eliminated the woman from the list of suspects.,1
369,Her alibi checked out.,The police kept the woman on the list of suspects.,The police interrogated her.,The police kept the woman on the list of suspects.,1
370,The climbers reached the peak of the mountain.,They congratulated each other.,The climbers reached the peak of the mountain.,They encountered an avalanche.,0
371,The climbers failed to reach the peak of the mountain.,They congratulated each other.,The climbers failed to reach the peak of the mountain.,They encountered an avalanche.,1
372,The vandals threw a rock at the window.,The window cracked.,The vandals threw a rock at the window.,The window fogged up.,0
373,The vandals blew cold air at the window.,The window cracked.,The vandals blew cold air at the window.,The window fogged up.,1
374,The fortune teller's revelations were convincing.,She received many returning customers.,The fortune teller's revelations were convincing.,Many customers asked for refunds.,0
375,The fortune teller's revelations were false.,Many customers asked for refunds.,The fortune teller's revelations were false.,She received many returning customers.,0
376,She brushed her hair.,The woman's makeup smeared.,She wiped her eyes.,The woman's makeup smeared.,1
377,She brushed her hair.,The woman's head looked nice.,She wiped her eyes.,The woman's head looked nice.,0
378,The company's profits started to level off.,It increased its marketing efforts for new products.,The company's profits started to level off.,It moved its headquarters to a suburban location.,0
379,The company was seeking highly specialized talent.,It moved its headquarters to a suburban location.,The company was seeking highly specialized talent.,It increased its marketing efforts for new products.,0
380,The student's answer on the exam was incorrect.,The teacher subtracted points off the student's grade.,The student's answer on the exam was incorrect.,The teacher added bonus points to the student's grade.,0
381,The student's answer on the exam was extraordinary.,The teacher subtracted points off the student's grade.,The student's answer on the exam was extraordinary.,The teacher added bonus points to the student's grade.,1
382,The girl wanted to demonstrate proper etiquette.,She put her napkin on her lap before eating.,The girl wanted to demonstrate proper etiquette.,She threw away her napkin after eating.,0
383,The girl demonstrated poor etiquette.,She threw away her napkin after eating.,The girl demonstrated poor etiquette.,She put her napkin on her lap before eating.,0
